[
  {
    "id": "SH-CUSTOMER",
    "name": "顧客（Customer）",
    "role": "サービス利用者",
    "description": "飲食店、美容室、医療機関などのサービスを利用するために予約を行う一般顧客。スマートフォンまたはPCから予約サイトにアクセスし、自身で予約の登録・変更・キャンセルを行う。",
    "needs": [
      "24時間いつでも予約したい",
      "空き状況を簡単に確認したい",
      "予約内容を変更・キャンセルしたい",
      "予約の確認を簡単にしたい"
    ],
    "successCriteria": [
      "予約完了までの操作時間が3分以内",
      "スマートフォンからの予約が全体の70%以上",
      "顧客満足度4.5/5.0以上"
    ],
    "priority": "critical",
    "influence": "high",
    "interest": "high"
  },
  {
    "id": "SH-STAFF",
    "name": "店舗スタッフ（Store Staff）",
    "role": "予約管理担当者",
    "description": "店舗で顧客対応を行うスタッフ。予約管理画面から予約状況を確認し、必要に応じて予約の調整や顧客情報の参照を行う。サービス提供時には予約ステータスを更新する。",
    "needs": [
      "予約状況を一目で確認したい",
      "緊急時の予約調整が簡単にできる",
      "顧客情報を参照したい",
      "予約の統計情報を見たい"
    ],
    "successCriteria": [
      "予約確認作業時間が従来比50%削減",
      "ダブルブッキング発生率0%",
      "予約一覧表示が1秒以内"
    ],
    "contact": {
      "department": "店舗運営部"
    },
    "priority": "high",
    "influence": "high",
    "interest": "high"
  },
  {
    "id": "SH-MANAGER",
    "name": "店舗管理者（Store Manager）",
    "role": "店舗運営責任者",
    "description": "店舗の運営を統括する管理者。予約枠の設定、営業カレンダーの管理、スタッフの権限管理、予約実績のレポート確認を行う。経営判断のためのデータ分析も実施する。",
    "needs": [
      "営業日・営業時間を柔軟に設定したい",
      "予約枠の設定を簡単に変更したい",
      "予約実績のレポートを確認したい",
      "スタッフの権限管理をしたい"
    ],
    "successCriteria": [
      "予約枠設定変更が5分以内に完了",
      "月次レポートが自動生成される",
      "予約データから経営判断が可能"
    ],
    "contact": {
      "department": "店舗管理部"
    },
    "priority": "high",
    "influence": "high",
    "interest": "medium"
  },
  {
    "id": "SH-SYSADMIN",
    "name": "システム管理者（System Administrator）",
    "role": "システム運用保守担当者",
    "description": "システム全体の運用・保守を担当する技術者。システムの稼働状況監視、バックアップ管理、セキュリティ維持、障害対応を行う。",
    "needs": [
      "システムの稼働状況を監視したい",
      "バックアップを自動化したい",
      "セキュリティを維持したい",
      "障害発生時に迅速に対応したい"
    ],
    "successCriteria": [
      "システム稼働率99.9%以上",
      "データバックアップが毎日自動実行",
      "障害検知から復旧まで30分以内"
    ],
    "contact": {
      "department": "IT部門"
    },
    "priority": "high",
    "influence": "medium",
    "interest": "medium"
  },
  {
    "id": "SH-DEVELOPER",
    "name": "開発チーム（Development Team）",
    "role": "システム開発担当者",
    "description": "システムの設計・開発・テストを担当する開発チーム。要件定義に基づいてシステムを実装し、品質を確保する。",
    "needs": [
      "明確な要件定義が欲しい",
      "技術的な制約を理解したい",
      "テスト環境が必要",
      "APIドキュメントが必要"
    ],
    "successCriteria": [
      "開発完了がスケジュール通り（±10%以内）",
      "バグ発生率がCritical 0件、High 5件以下",
      "テストカバレッジ80%以上"
    ],
    "contact": {
      "department": "開発部門"
    },
    "priority": "medium",
    "influence": "medium",
    "interest": "high"
  },
  {
    "id": "SH-EXECUTIVE",
    "name": "経営層（Executive Sponsor）",
    "role": "プロジェクトスポンサー",
    "description": "プロジェクトの最終承認者。予算承認、重要な意思決定、プロジェクトの進捗確認を行う。投資対効果（ROI）を重視する。",
    "needs": [
      "投資対効果を確認したい",
      "プロジェクトの進捗を把握したい",
      "リスクを管理したい",
      "事業戦略との整合性を確認したい"
    ],
    "successCriteria": [
      "オンライン予約率80%以上達成",
      "予約管理コスト30%削減",
      "顧客満足度向上による売上20%増加"
    ],
    "contact": {
      "department": "経営企画部"
    },
    "priority": "critical",
    "influence": "high",
    "interest": "low"
  }
]
